{
  "bundle_key": "mindspore.Tensor.hardshrink::hshrink_op.yaml",
  "bundle_mode": "ms_centered",
  "schema_version": "v1",
  "generated_at": "2026-04-02T00:18:12+08:00",
  "identity": {
    "public_api": "mindspore.Tensor.hardshrink",
    "public_surface": "mindspore.Tensor",
    "api_name": "hardshrink",
    "op_branch": "hshrink_op.yaml",
    "op": "hshrink",
    "primitive": "HShrink",
    "interface": "tensor",
    "target_symbol": "hardshrink",
    "py_method": "tensor_hardshrink",
    "resolver_kind": "api_def_interface",
    "resolver_path": "mindspore/ops/api_def/hardshrink.yaml",
    "source_file": "mindspore/ops/api_def/hardshrink.yaml"
  },
  "coverage": {
    "coverage_key": "hshrink::HShrink",
    "op_yaml_path": "mindspore/ops/op_def/yaml/hshrink_op.yaml",
    "class_name": "HShrink",
    "dispatch_enable": true,
    "dispatch_kind": "customize",
    "dispatch_ascend": "HShrinkAscend",
    "aclnn": [
      "aclnnHardshrink"
    ],
    "aclnn_source": [
      "customize_source"
    ],
    "infer": true,
    "pyboost": true,
    "kbk": true,
    "bprop": true,
    "ut": true,
    "st": true,
    "docs_cn": false,
    "docs_en": true
  }
}
