{
  "bundle_key": "mindspore.Tensor.remainder_::inplace_remainder_tensor_tensor_op.yaml",
  "bundle_mode": "ms_centered",
  "schema_version": "v1",
  "generated_at": "2026-04-02T00:18:12+08:00",
  "identity": {
    "public_api": "mindspore.Tensor.remainder_",
    "public_surface": "mindspore.Tensor",
    "api_name": "remainder_",
    "op_branch": "inplace_remainder_tensor_tensor_op.yaml",
    "op": "inplace_remainder_tensor_tensor",
    "primitive": "InplaceRemainderTensorTensor",
    "interface": "tensor",
    "target_symbol": "remainder_",
    "py_method": "tensor_remainder_",
    "resolver_kind": "api_def_interface",
    "resolver_path": "mindspore/ops/api_def/remainder_.yaml",
    "source_file": "mindspore/ops/api_def/remainder_.yaml"
  },
  "coverage": {
    "coverage_key": "inplace_remainder_tensor_tensor::InplaceRemainderTensorTensor",
    "op_yaml_path": "mindspore/ops/op_def/yaml/inplace_remainder_tensor_tensor_op.yaml",
    "class_name": "InplaceRemainderTensorTensor",
    "dispatch_enable": true,
    "dispatch_kind": "customize",
    "dispatch_ascend": "InplaceRemainderTensorTensorAscend",
    "aclnn": [
      "aclnnInplaceRemainderTensorTensor"
    ],
    "aclnn_source": [
      "customize_source"
    ],
    "infer": true,
    "pyboost": true,
    "kbk": false,
    "bprop": true,
    "ut": true,
    "st": false,
    "docs_cn": false,
    "docs_en": false
  }
}
