{
  "bundle_key": "mindspore.ops.floor_divide::floor_div_scalar_op.yaml",
  "bundle_mode": "ms_centered",
  "schema_version": "v1",
  "generated_at": "2026-04-02T00:18:12+08:00",
  "identity": {
    "public_api": "mindspore.ops.floor_divide",
    "public_surface": "mindspore.ops",
    "api_name": "floor_divide",
    "op_branch": "floor_div_scalar_op.yaml",
    "op": "floor_div_scalar",
    "primitive": "FloorDivScalar",
    "interface": "tensor, function",
    "target_symbol": "floor_divide",
    "py_method": "tensor_floor_div_scalar",
    "resolver_kind": "api_def_interface",
    "resolver_path": "mindspore/ops/api_def/floor_divide.yaml",
    "source_file": "mindspore/ops/api_def/floor_divide.yaml"
  },
  "coverage": {
    "coverage_key": "floor_div_scalar::FloorDivScalar",
    "op_yaml_path": "mindspore/ops/op_def/yaml/floor_div_scalar_op.yaml",
    "class_name": "FloorDivScalar",
    "dispatch_enable": true,
    "dispatch_kind": "customize",
    "dispatch_ascend": "FloorDivScalarAscend",
    "aclnn": [
      "aclnnFloorDivides"
    ],
    "aclnn_source": [
      "customize_source"
    ],
    "infer": true,
    "pyboost": true,
    "kbk": true,
    "bprop": true,
    "ut": false,
    "st": false,
    "docs_cn": false,
    "docs_en": false
  }
}
