{
  "bundle_key": "mindspore.Tensor.fmod::fmod_scalar_op.yaml",
  "bundle_mode": "ms_centered",
  "schema_version": "v1",
  "generated_at": "2026-04-02T00:18:12+08:00",
  "identity": {
    "public_api": "mindspore.Tensor.fmod",
    "public_surface": "mindspore.Tensor",
    "api_name": "fmod",
    "op_branch": "fmod_scalar_op.yaml",
    "op": "fmod_scalar",
    "primitive": "FmodScalar",
    "interface": "function, tensor",
    "target_symbol": "fmod",
    "py_method": "fmod_scalar",
    "resolver_kind": "api_def_interface",
    "resolver_path": "mindspore/ops/api_def/fmod.yaml",
    "source_file": "mindspore/ops/api_def/fmod.yaml"
  },
  "coverage": {
    "coverage_key": "fmod_scalar::FmodScalar",
    "op_yaml_path": "mindspore/ops/op_def/yaml/fmod_scalar_op.yaml",
    "class_name": "FmodScalar",
    "dispatch_enable": true,
    "dispatch_kind": "auto_generate",
    "dispatch_ascend": "default",
    "aclnn": [
      "aclnnFmodScalar"
    ],
    "aclnn_source": [
      "auto_generate_source"
    ],
    "infer": true,
    "pyboost": true,
    "kbk": true,
    "bprop": true,
    "ut": false,
    "st": false,
    "docs_cn": false,
    "docs_en": false
  }
}
