{
  "bundle_key": "mindspore.Tensor.repeat_interleave::repeat_interleave_tensor_op.yaml",
  "bundle_mode": "ms_centered",
  "schema_version": "v1",
  "generated_at": "2026-04-02T00:18:12+08:00",
  "identity": {
    "public_api": "mindspore.Tensor.repeat_interleave",
    "public_surface": "mindspore.Tensor",
    "api_name": "repeat_interleave",
    "op_branch": "repeat_interleave_tensor_op.yaml",
    "op": "repeat_interleave_tensor",
    "primitive": "RepeatInterleaveTensor",
    "interface": "tensor, function",
    "target_symbol": "repeat_interleave",
    "py_method": "tensor_repeat_interleave_ext",
    "resolver_kind": "api_def_interface",
    "resolver_path": "mindspore/ops/api_def/repeat_interleave.yaml",
    "source_file": "mindspore/ops/api_def/repeat_interleave.yaml"
  },
  "coverage": {
    "coverage_key": "repeat_interleave_tensor::RepeatInterleaveTensor",
    "op_yaml_path": "mindspore/ops/op_def/yaml/repeat_interleave_tensor_op.yaml",
    "class_name": "RepeatInterleaveTensor",
    "dispatch_enable": true,
    "dispatch_kind": "customize",
    "dispatch_ascend": "RepeatInterleaveTensorAscend",
    "aclnn": [
      "aclnnRepeatInterleave",
      "aclnnRepeatInterleaveWithDim"
    ],
    "aclnn_source": [
      "customize_source"
    ],
    "infer": true,
    "pyboost": true,
    "kbk": true,
    "bprop": true,
    "ut": false,
    "st": false,
    "docs_cn": false,
    "docs_en": true
  }
}
