{
  "bundle_key": "mindspore.Tensor.nansum::nansum_op.yaml",
  "bundle_mode": "ms_centered",
  "schema_version": "v1",
  "generated_at": "2026-04-02T00:18:12+08:00",
  "identity": {
    "public_api": "mindspore.Tensor.nansum",
    "public_surface": "mindspore.Tensor",
    "api_name": "nansum",
    "op_branch": "nansum_op.yaml",
    "op": "nansum",
    "primitive": "Nansum",
    "interface": "tensor, function",
    "target_symbol": "nansum",
    "py_method": "deprecated_tensor_nansum",
    "resolver_kind": "api_def_interface",
    "resolver_path": "mindspore/ops/api_def/nansum.yaml",
    "source_file": "mindspore/ops/api_def/nansum.yaml"
  },
  "coverage": {
    "coverage_key": "nansum::Nansum",
    "op_yaml_path": "mindspore/ops/op_def/yaml/nansum_op.yaml",
    "class_name": "Nansum",
    "dispatch_enable": true,
    "dispatch_kind": "customize",
    "dispatch_ascend": "NansumAscend",
    "aclnn": [
      "aclnnReduceNansum"
    ],
    "aclnn_source": [
      "customize_source"
    ],
    "infer": true,
    "pyboost": true,
    "kbk": true,
    "bprop": true,
    "ut": true,
    "st": true,
    "docs_cn": false,
    "docs_en": true
  }
}
