{
  "bundle_key": "mindspore.Tensor.sigmoid_::inplace_sigmoid_op.yaml",
  "bundle_mode": "ms_centered",
  "schema_version": "v1",
  "generated_at": "2026-04-02T00:18:12+08:00",
  "identity": {
    "public_api": "mindspore.Tensor.sigmoid_",
    "public_surface": "mindspore.Tensor",
    "api_name": "sigmoid_",
    "op_branch": "inplace_sigmoid_op.yaml",
    "op": "inplace_sigmoid",
    "primitive": "InplaceSigmoid",
    "interface": "tensor",
    "target_symbol": "sigmoid_",
    "py_method": "tensor_sigmoid_",
    "resolver_kind": "api_def_interface",
    "resolver_path": "mindspore/ops/api_def/sigmoid_.yaml",
    "source_file": "mindspore/ops/api_def/sigmoid_.yaml"
  },
  "coverage": {
    "coverage_key": "inplace_sigmoid::InplaceSigmoid",
    "op_yaml_path": "mindspore/ops/op_def/yaml/inplace_sigmoid_op.yaml",
    "class_name": "InplaceSigmoid",
    "dispatch_enable": true,
    "dispatch_kind": "customize",
    "dispatch_ascend": "InplaceSigmoidAscend",
    "aclnn": [
      "aclnnInplaceSigmoid"
    ],
    "aclnn_source": [
      "customize_source"
    ],
    "infer": true,
    "pyboost": true,
    "kbk": true,
    "bprop": true,
    "ut": true,
    "st": false,
    "docs_cn": false,
    "docs_en": true
  }
}
