{
  "bundle_key": "mindspore.Tensor.isclose::isclose_op.yaml",
  "bundle_mode": "ms_centered",
  "schema_version": "v1",
  "generated_at": "2026-04-02T00:18:12+08:00",
  "identity": {
    "public_api": "mindspore.Tensor.isclose",
    "public_surface": "mindspore.Tensor",
    "api_name": "isclose",
    "op_branch": "isclose_op.yaml",
    "op": "isclose",
    "primitive": "IsClose",
    "interface": "tensor",
    "target_symbol": "isclose",
    "py_method": "deprecated_tensor_isclose",
    "resolver_kind": "api_def_interface",
    "resolver_path": "mindspore/ops/api_def/isclose.yaml",
    "source_file": "mindspore/ops/api_def/isclose.yaml"
  },
  "coverage": {
    "coverage_key": "isclose::IsClose",
    "op_yaml_path": "mindspore/ops/op_def/yaml/isclose_op.yaml",
    "class_name": "IsClose",
    "dispatch_enable": true,
    "dispatch_kind": "customize",
    "dispatch_ascend": "IsCloseAscend",
    "aclnn": [
      "aclnnIsClose"
    ],
    "aclnn_source": [
      "customize_source"
    ],
    "infer": true,
    "pyboost": true,
    "kbk": true,
    "bprop": false,
    "ut": true,
    "st": true,
    "docs_cn": false,
    "docs_en": true
  }
}
