{
  "bundle_key": "mindspore.mint.matmul::matmul_ext_op.yaml",
  "bundle_mode": "ms_centered",
  "schema_version": "v1",
  "generated_at": "2026-04-02T00:18:12+08:00",
  "identity": {
    "public_api": "mindspore.mint.matmul",
    "public_surface": "mindspore.mint",
    "api_name": "matmul",
    "op_branch": "matmul_ext_op.yaml",
    "op": "matmul_ext",
    "primitive": "MatMulExt",
    "interface": "tensor",
    "target_symbol": "matmul",
    "py_method": "tensor_matmul",
    "resolver_kind": "api_def",
    "resolver_path": "mindspore.ops.functional.matmul",
    "source_file": "mindspore/python/mindspore/mint/__init__.py"
  },
  "coverage": {
    "coverage_key": "matmul_ext::MatMulExt",
    "op_yaml_path": "mindspore/ops/op_def/yaml/matmul_ext_op.yaml",
    "class_name": "MatMulExt",
    "dispatch_enable": true,
    "dispatch_kind": "customize",
    "dispatch_ascend": "MatMulExtAscend",
    "aclnn": [
      "aclnnMatmul"
    ],
    "aclnn_source": [
      "customize_source"
    ],
    "infer": true,
    "pyboost": true,
    "kbk": true,
    "bprop": true,
    "ut": false,
    "st": true,
    "docs_cn": false,
    "docs_en": false
  }
}
