{
  "bundle_key": "mindspore.Tensor.logaddexp2::logaddexp2_op.yaml",
  "bundle_mode": "ms_centered",
  "schema_version": "v1",
  "generated_at": "2026-04-02T00:18:12+08:00",
  "identity": {
    "public_api": "mindspore.Tensor.logaddexp2",
    "public_surface": "mindspore.Tensor",
    "api_name": "logaddexp2",
    "op_branch": "logaddexp2_op.yaml",
    "op": "logaddexp2",
    "primitive": "LogAddExp2",
    "interface": "tensor",
    "target_symbol": "logaddexp2",
    "py_method": "deprecated_tensor_logaddexp2",
    "resolver_kind": "api_def_interface",
    "resolver_path": "mindspore/ops/api_def/logaddexp2.yaml",
    "source_file": "mindspore/ops/api_def/logaddexp2.yaml"
  },
  "coverage": {
    "coverage_key": "logaddexp2::LogAddExp2",
    "op_yaml_path": "mindspore/ops/op_def/yaml/logaddexp2_op.yaml",
    "class_name": "LogAddExp2",
    "dispatch_enable": true,
    "dispatch_kind": "auto_generate",
    "dispatch_ascend": "default",
    "aclnn": [
      "aclnnLogAddExp2"
    ],
    "aclnn_source": [
      "aclnn_config"
    ],
    "infer": true,
    "pyboost": true,
    "kbk": true,
    "bprop": true,
    "ut": true,
    "st": false,
    "docs_cn": false,
    "docs_en": true
  }
}
