{
  "bundle_key": "mindspore.mint.logical_or::logical_or_op.yaml",
  "bundle_mode": "ms_centered",
  "schema_version": "v1",
  "generated_at": "2026-04-02T00:18:12+08:00",
  "identity": {
    "public_api": "mindspore.mint.logical_or",
    "public_surface": "mindspore.mint",
    "api_name": "logical_or",
    "op_branch": "logical_or_op.yaml",
    "op": "logical_or",
    "primitive": "LogicalOr",
    "interface": "tensor",
    "target_symbol": "logical_or",
    "py_method": "tensor_logical_or",
    "resolver_kind": "api_def",
    "resolver_path": "mindspore.ops.functional.logical_or",
    "source_file": "mindspore/python/mindspore/mint/__init__.py"
  },
  "coverage": {
    "coverage_key": "logical_or::LogicalOr",
    "op_yaml_path": "mindspore/ops/op_def/yaml/logical_or_op.yaml",
    "class_name": "LogicalOr",
    "dispatch_enable": true,
    "dispatch_kind": "auto_generate",
    "dispatch_ascend": "default",
    "aclnn": [
      "aclnnLogicalOr"
    ],
    "aclnn_source": [
      "auto_generate_source"
    ],
    "infer": true,
    "pyboost": true,
    "kbk": true,
    "bprop": true,
    "ut": true,
    "st": true,
    "docs_cn": false,
    "docs_en": true
  }
}
