{
  "bundle_key": "mindspore.mint.sort::sort_ext_op.yaml",
  "bundle_mode": "ms_centered",
  "schema_version": "v1",
  "generated_at": "2026-04-02T00:18:12+08:00",
  "identity": {
    "public_api": "mindspore.mint.sort",
    "public_surface": "mindspore.mint",
    "api_name": "sort",
    "op_branch": "sort_ext_op.yaml",
    "op": "sort_ext",
    "primitive": "SortExt",
    "interface": "",
    "target_symbol": "sort_ext",
    "py_method": "",
    "resolver_kind": "op_def",
    "resolver_path": "mindspore.ops.function.array_func.sort_ext",
    "source_file": "mindspore/python/mindspore/mint/__init__.py"
  },
  "coverage": {
    "coverage_key": "sort_ext::SortExt",
    "op_yaml_path": "mindspore/ops/op_def/yaml/sort_ext_op.yaml",
    "class_name": "SortExt",
    "dispatch_enable": true,
    "dispatch_kind": "customize",
    "dispatch_ascend": "SortExtAscend",
    "aclnn": [
      "aclnnSort"
    ],
    "aclnn_source": [
      "customize_source"
    ],
    "infer": true,
    "pyboost": true,
    "kbk": true,
    "bprop": true,
    "ut": true,
    "st": false,
    "docs_cn": false,
    "docs_en": false
  }
}
