{
  "bundle_key": "mindspore.Tensor.__mod__::remainder_tensor_tensor_op.yaml",
  "bundle_mode": "ms_centered",
  "schema_version": "v1",
  "generated_at": "2026-04-02T00:18:12+08:00",
  "identity": {
    "public_api": "mindspore.Tensor.__mod__",
    "public_surface": "mindspore.Tensor",
    "api_name": "__mod__",
    "op_branch": "remainder_tensor_tensor_op.yaml",
    "op": "remainder_tensor_tensor",
    "primitive": "RemainderTensorTensor",
    "interface": "tensor",
    "target_symbol": "__mod__",
    "py_method": "deprecated_tensor_mod",
    "resolver_kind": "api_def_interface",
    "resolver_path": "mindspore/ops/api_def/__mod__.yaml",
    "source_file": "mindspore/ops/api_def/__mod__.yaml"
  },
  "coverage": {
    "coverage_key": "remainder_tensor_tensor::RemainderTensorTensor",
    "op_yaml_path": "mindspore/ops/op_def/yaml/remainder_tensor_tensor_op.yaml",
    "class_name": "RemainderTensorTensor",
    "dispatch_enable": true,
    "dispatch_kind": "auto_generate",
    "dispatch_ascend": "default",
    "aclnn": [
      "aclnnRemainderTensorTensor"
    ],
    "aclnn_source": [
      "auto_generate_source"
    ],
    "infer": true,
    "pyboost": true,
    "kbk": true,
    "bprop": true,
    "ut": true,
    "st": false,
    "docs_cn": false,
    "docs_en": false
  }
}
