{
  "bundle_key": "mindspore.Tensor.scatter::scatter_value_op.yaml",
  "bundle_mode": "ms_centered",
  "schema_version": "v1",
  "generated_at": "2026-04-02T00:18:12+08:00",
  "identity": {
    "public_api": "mindspore.Tensor.scatter",
    "public_surface": "mindspore.Tensor",
    "api_name": "scatter",
    "op_branch": "scatter_value_op.yaml",
    "op": "scatter_value",
    "primitive": "ScatterValue",
    "interface": "tensor",
    "target_symbol": "scatter",
    "py_method": "tensor_scatter",
    "resolver_kind": "api_def_interface",
    "resolver_path": "mindspore/ops/api_def/scatter.yaml",
    "source_file": "mindspore/ops/api_def/scatter.yaml"
  },
  "coverage": {
    "coverage_key": "scatter_value::ScatterValue",
    "op_yaml_path": "mindspore/ops/op_def/yaml/scatter_value_op.yaml",
    "class_name": "ScatterValue",
    "dispatch_enable": true,
    "dispatch_kind": "auto_generate",
    "dispatch_ascend": "default",
    "aclnn": [
      "aclnnScatterValue"
    ],
    "aclnn_source": [
      "auto_generate_source"
    ],
    "infer": true,
    "pyboost": true,
    "kbk": true,
    "bprop": true,
    "ut": true,
    "st": false,
    "docs_cn": false,
    "docs_en": false
  }
}
