{
  "bundle_key": "mindspore.mint.eq::eq_scalar_op.yaml",
  "bundle_mode": "ms_centered",
  "schema_version": "v1",
  "generated_at": "2026-04-02T00:18:12+08:00",
  "identity": {
    "public_api": "mindspore.mint.eq",
    "public_surface": "mindspore.mint",
    "api_name": "eq",
    "op_branch": "eq_scalar_op.yaml",
    "op": "eq_scalar",
    "primitive": "EqScalar",
    "interface": "tensor, function",
    "target_symbol": "eq",
    "py_method": "tensor_eq",
    "resolver_kind": "api_def",
    "resolver_path": "mindspore.ops.functional_overload.eq",
    "source_file": "mindspore/python/mindspore/mint/__init__.py"
  },
  "coverage": {
    "coverage_key": "eq_scalar::EqScalar",
    "op_yaml_path": "mindspore/ops/op_def/yaml/eq_scalar_op.yaml",
    "class_name": "EqScalar",
    "dispatch_enable": true,
    "dispatch_kind": "auto_generate",
    "dispatch_ascend": "default",
    "aclnn": [
      "aclnnEqScalar"
    ],
    "aclnn_source": [
      "auto_generate_source"
    ],
    "infer": true,
    "pyboost": true,
    "kbk": true,
    "bprop": true,
    "ut": true,
    "st": false,
    "docs_cn": false,
    "docs_en": false
  }
}
