{
  "bundle_key": "mindspore.Tensor.dot::dot_op.yaml",
  "bundle_mode": "ms_centered",
  "schema_version": "v1",
  "generated_at": "2026-04-02T00:18:12+08:00",
  "identity": {
    "public_api": "mindspore.Tensor.dot",
    "public_surface": "mindspore.Tensor",
    "api_name": "dot",
    "op_branch": "dot_op.yaml",
    "op": "dot",
    "primitive": "Dot",
    "interface": "tensor",
    "target_symbol": "dot",
    "py_method": "deprecated_tensor_dot",
    "resolver_kind": "api_def_interface",
    "resolver_path": "mindspore/ops/api_def/dot.yaml",
    "source_file": "mindspore/ops/api_def/dot.yaml"
  },
  "coverage": {
    "coverage_key": "dot::Dot",
    "op_yaml_path": "mindspore/ops/op_def/yaml/dot_op.yaml",
    "class_name": "Dot",
    "dispatch_enable": true,
    "dispatch_kind": "auto_generate",
    "dispatch_ascend": "default",
    "aclnn": [
      "aclnnDot"
    ],
    "aclnn_source": [
      "auto_generate_source"
    ],
    "infer": true,
    "pyboost": true,
    "kbk": true,
    "bprop": true,
    "ut": true,
    "st": true,
    "docs_cn": false,
    "docs_en": true
  }
}
