{
  "bundle_key": "mindspore.Tensor.index_fill_::inplace_index_fill_tensor_op.yaml",
  "bundle_mode": "ms_centered",
  "schema_version": "v1",
  "generated_at": "2026-04-02T00:18:12+08:00",
  "identity": {
    "public_api": "mindspore.Tensor.index_fill_",
    "public_surface": "mindspore.Tensor",
    "api_name": "index_fill_",
    "op_branch": "inplace_index_fill_tensor_op.yaml",
    "op": "inplace_index_fill_tensor",
    "primitive": "InplaceIndexFillTensor",
    "interface": "tensor",
    "target_symbol": "index_fill_",
    "py_method": "tensor_index_fill_",
    "resolver_kind": "api_def_interface",
    "resolver_path": "mindspore/ops/api_def/index_fill_.yaml",
    "source_file": "mindspore/ops/api_def/index_fill_.yaml"
  },
  "coverage": {
    "coverage_key": "inplace_index_fill_tensor::InplaceIndexFillTensor",
    "op_yaml_path": "mindspore/ops/op_def/yaml/inplace_index_fill_tensor_op.yaml",
    "class_name": "InplaceIndexFillTensor",
    "dispatch_enable": true,
    "dispatch_kind": "customize",
    "dispatch_ascend": "InplaceIndexFillTensorAscend",
    "aclnn": [
      "aclnnInplaceIndexFillTensor"
    ],
    "aclnn_source": [
      "customize_source"
    ],
    "infer": true,
    "pyboost": true,
    "kbk": true,
    "bprop": true,
    "ut": false,
    "st": false,
    "docs_cn": false,
    "docs_en": false
  }
}
