{
  "bundle_key": "mindspore.mint.xlogy::xlogy_op.yaml",
  "bundle_mode": "ms_centered",
  "schema_version": "v1",
  "generated_at": "2026-04-02T00:18:12+08:00",
  "identity": {
    "public_api": "mindspore.mint.xlogy",
    "public_surface": "mindspore.mint",
    "api_name": "xlogy",
    "op_branch": "xlogy_op.yaml",
    "op": "xlogy",
    "primitive": "Xlogy",
    "interface": "tensor, function",
    "target_symbol": "xlogy",
    "py_method": "tensor_xlogy",
    "resolver_kind": "api_def",
    "resolver_path": "mindspore.ops.functional_overload.xlogy",
    "source_file": "mindspore/python/mindspore/mint/__init__.py"
  },
  "coverage": {
    "coverage_key": "xlogy::Xlogy",
    "op_yaml_path": "mindspore/ops/op_def/yaml/xlogy_op.yaml",
    "class_name": "Xlogy",
    "dispatch_enable": true,
    "dispatch_kind": "auto_generate",
    "dispatch_ascend": "default",
    "aclnn": [
      "aclnnXLogYTensor"
    ],
    "aclnn_source": [
      "aclnn_config"
    ],
    "infer": true,
    "pyboost": true,
    "kbk": true,
    "bprop": true,
    "ut": false,
    "st": true,
    "docs_cn": false,
    "docs_en": true
  }
}
