{
  "bundle_key": "mindspore.Tensor.repeat::repeat_op.yaml",
  "bundle_mode": "ms_centered",
  "schema_version": "v1",
  "generated_at": "2026-04-02T00:18:12+08:00",
  "identity": {
    "public_api": "mindspore.Tensor.repeat",
    "public_surface": "mindspore.Tensor",
    "api_name": "repeat",
    "op_branch": "repeat_op.yaml",
    "op": "repeat",
    "primitive": "Repeat",
    "interface": "tensor",
    "target_symbol": "repeat",
    "py_method": "tensor_repeat",
    "resolver_kind": "api_def_interface",
    "resolver_path": "mindspore/ops/api_def/repeat.yaml",
    "source_file": "mindspore/ops/api_def/repeat.yaml"
  },
  "coverage": {
    "coverage_key": "repeat::Repeat",
    "op_yaml_path": "mindspore/ops/op_def/yaml/repeat_op.yaml",
    "class_name": "Repeat",
    "dispatch_enable": true,
    "dispatch_kind": "auto_generate",
    "dispatch_ascend": "default",
    "aclnn": [
      "aclnnRepeat"
    ],
    "aclnn_source": [
      "auto_generate_source"
    ],
    "infer": true,
    "pyboost": true,
    "kbk": true,
    "bprop": true,
    "ut": true,
    "st": false,
    "docs_cn": false,
    "docs_en": true
  }
}
