{
  "bundle_key": "mindspore.mint.normal::normal_float_tensor_op.yaml",
  "bundle_mode": "ms_centered",
  "schema_version": "v1",
  "generated_at": "2026-04-02T00:18:12+08:00",
  "identity": {
    "public_api": "mindspore.mint.normal",
    "public_surface": "mindspore.mint",
    "api_name": "normal",
    "op_branch": "normal_float_tensor_op.yaml",
    "op": "normal_float_tensor",
    "primitive": "NormalFloatTensor",
    "interface": "",
    "target_symbol": "normal_ext",
    "py_method": "",
    "resolver_kind": "op_def",
    "resolver_path": "mindspore.ops.function.random_func.normal_float_tensor_op",
    "source_file": "mindspore/python/mindspore/mint/__init__.py"
  },
  "coverage": {
    "coverage_key": "normal_float_tensor::NormalFloatTensor",
    "op_yaml_path": "mindspore/ops/op_def/yaml/normal_float_tensor_op.yaml",
    "class_name": "NormalFloatTensor",
    "dispatch_enable": true,
    "dispatch_kind": "customize",
    "dispatch_ascend": "NormalFloatTensorAscend",
    "aclnn": [
      "aclnnNormalFloatTensor"
    ],
    "aclnn_source": [
      "customize_source"
    ],
    "infer": true,
    "pyboost": true,
    "kbk": true,
    "bprop": true,
    "ut": true,
    "st": false,
    "docs_cn": false,
    "docs_en": false
  }
}
