{
  "bundle_key": "mindspore.Tensor.put_::inplace_put_op.yaml",
  "bundle_mode": "ms_centered",
  "schema_version": "v1",
  "generated_at": "2026-04-02T00:18:12+08:00",
  "identity": {
    "public_api": "mindspore.Tensor.put_",
    "public_surface": "mindspore.Tensor",
    "api_name": "put_",
    "op_branch": "inplace_put_op.yaml",
    "op": "inplace_put",
    "primitive": "InplacePut",
    "interface": "tensor",
    "target_symbol": "put_",
    "py_method": "tensor_put_",
    "resolver_kind": "api_def_interface",
    "resolver_path": "mindspore/ops/api_def/put_.yaml",
    "source_file": "mindspore/ops/api_def/put_.yaml"
  },
  "coverage": {
    "coverage_key": "inplace_put::InplacePut",
    "op_yaml_path": "mindspore/ops/op_def/yaml/inplace_put_op.yaml",
    "class_name": "InplacePut",
    "dispatch_enable": true,
    "dispatch_kind": "customize",
    "dispatch_ascend": "InplacePutAscend",
    "aclnn": [
      "aclnnInplacePut"
    ],
    "aclnn_source": [
      "customize_source"
    ],
    "infer": true,
    "pyboost": true,
    "kbk": true,
    "bprop": true,
    "ut": true,
    "st": false,
    "docs_cn": false,
    "docs_en": false
  }
}
