{
  "bundle_key": "mindspore.ops.xlogy::xlogy_scalar_other_op.yaml",
  "bundle_mode": "ms_centered",
  "schema_version": "v1",
  "generated_at": "2026-04-02T00:18:12+08:00",
  "identity": {
    "public_api": "mindspore.ops.xlogy",
    "public_surface": "mindspore.ops",
    "api_name": "xlogy",
    "op_branch": "xlogy_scalar_other_op.yaml",
    "op": "xlogy_scalar_other",
    "primitive": "XLogYScalarOther",
    "interface": "tensor, function",
    "target_symbol": "xlogy",
    "py_method": "tensor_xlogy",
    "resolver_kind": "api_def_interface",
    "resolver_path": "mindspore/ops/api_def/xlogy.yaml",
    "source_file": "mindspore/ops/api_def/xlogy.yaml"
  },
  "coverage": {
    "coverage_key": "xlogy_scalar_other::XLogYScalarOther",
    "op_yaml_path": "mindspore/ops/op_def/yaml/xlogy_scalar_other_op.yaml",
    "class_name": "XLogYScalarOther",
    "dispatch_enable": true,
    "dispatch_kind": "auto_generate",
    "dispatch_ascend": "default",
    "aclnn": [
      "aclnnXLogYScalarOther"
    ],
    "aclnn_source": [
      "auto_generate_source"
    ],
    "infer": true,
    "pyboost": true,
    "kbk": true,
    "bprop": true,
    "ut": true,
    "st": false,
    "docs_cn": false,
    "docs_en": true
  }
}
